id,user_utterance,bot_utterance,,Giving Facts,Feeling,Share Personal Information
406,Ich weiß nicht,"Das ist in Ordnung, manchmal ist es nicht einfach, die Gründe für unsere Gefühle zu identifizieren. Es ist schon ein guter Anfang, dass du dir bewusst bist, dass du weniger prokrastinieren möchtest. Lass uns versuchen, ein bisschen tiefer zu graben. Was könnten die Vorteile sein, wenn du weniger prokrastinieren würdest""","Nutzer: Ich weiß nicht
Chatbot: Das ist in Ordnung, manchmal ist es nicht einfach, die Gründe für unsere Gefühle zu identifizieren. Es ist schon ein guter Anfang, dass du dir bewusst bist, dass du weniger prokrastinieren möchtest. Lass uns versuchen, ein bisschen tiefer zu graben. Was könnten die Vorteile sein, wenn du weniger prokrastinieren würdest""",0,0,1
148,Ich denke ich könnte noch weniger rotes Fleisch essen und eher auf vegetarische Produkte oder Fisch umsteigen. Das fällt mir noch schwer.,"Du hast also den Wunsch, weniger rotes Fleisch zu essen und mehr auf vegetarische Alternativen oder Fisch zurückzugreifen. Was genau macht diese Veränderung für dich schwierig","Nutzer: Ich denke ich könnte noch weniger rotes Fleisch essen und eher auf vegetarische Produkte oder Fisch umsteigen. Das fällt mir noch schwer.
Chatbot: Du hast also den Wunsch, weniger rotes Fleisch zu essen und mehr auf vegetarische Alternativen oder Fisch zurückzugreifen. Was genau macht diese Veränderung für dich schwierig",0,0,0
926,9,Eine 9. Du stehst dieser Veränderung also insgesamt positiv gegenüber. Kannst du mir etwas mehr über diese Einschätzung sagen? Warum hast du keinen höheren oder niedrigeren Wert angegeben?,"Nutzer: 9
Chatbot: Eine 9. Du stehst dieser Veränderung also insgesamt positiv gegenüber. Kannst du mir etwas mehr über diese Einschätzung sagen? Warum hast du keinen höheren oder niedrigeren Wert angegeben?",0,0,0
726,Es ist manchmal schwierig die regelmäßigen Zeiten einzuhalten und gelegentliche Heißhunger attacken,"Veränderungen können tatsächlich eine Herausforderung sein und es ist vollkommen normal, auf dem Weg dorthin auf Hindernisse zu stoßen. Es ist wichtig, realistisch zu bleiben und sich selbst zu vergeben, wenn man mal einen Fehler macht oder vom Weg abkommt. Hast du einen Plan, wie du mit diesen Herausforderungen umgehen kannst","Nutzer: Es ist manchmal schwierig die regelmäßigen Zeiten einzuhalten und gelegentliche Heißhunger attacken
Chatbot: Veränderungen können tatsächlich eine Herausforderung sein und es ist vollkommen normal, auf dem Weg dorthin auf Hindernisse zu stoßen. Es ist wichtig, realistisch zu bleiben und sich selbst zu vergeben, wenn man mal einen Fehler macht oder vom Weg abkommt. Hast du einen Plan, wie du mit diesen Herausforderungen umgehen kannst",1,0,0
1387,"Wenn ich einkaufen bin und emotional bin oder einen schlechten Tag hatte, ist es schwer nicht ""emotional"" einzukaufen und Süßigkeiten oder ungesundes Essen zu kaufen.","Emotionales Essen kann eine Herausforderung sein. Es ist normal, dass wir uns manchmal mit Essen trösten wollen, besonders wenn wir einen harten Tag hatten. Könntest du dir vorstellen, vor dem Einkaufen einen Plan zu erstellen, was du kaufen möchtest, um impulsiven Einkäufen vorzubeugen","Nutzer: Wenn ich einkaufen bin und emotional bin oder einen schlechten Tag hatte, ist es schwer nicht ""emotional"" einzukaufen und Süßigkeiten oder ungesundes Essen zu kaufen.
Chatbot: Emotionales Essen kann eine Herausforderung sein. Es ist normal, dass wir uns manchmal mit Essen trösten wollen, besonders wenn wir einen harten Tag hatten. Könntest du dir vorstellen, vor dem Einkaufen einen Plan zu erstellen, was du kaufen möchtest, um impulsiven Einkäufen vorzubeugen",0,0,1
172,"Mir ist es in der Kindheit/Teenagerzeit mal gelungen mich gesund zu ernähren, aber es ist schwierig, das dauerhaft beizubehalten.","Es ist beeindruckend, dass du schon einmal den Weg zu einer gesünderen Ernährung gefunden hast. Diese Erfahrung kann dir helfen, auch jetzt wieder einen gesunden Weg zu finden.","Nutzer: Mir ist es in der Kindheit/Teenagerzeit mal gelungen mich gesund zu ernähren, aber es ist schwierig, das dauerhaft beizubehalten.
Chatbot: Es ist beeindruckend, dass du schon einmal den Weg zu einer gesünderen Ernährung gefunden hast. Diese Erfahrung kann dir helfen, auch jetzt wieder einen gesunden Weg zu finden.",0,0,0